{"schema_version":"scenario-actions/v1","scenario_id":"S15","track":"Track4_HistoricalTemporal","name":"As-Of Time Travel Consistency","initial_fixture":"p0-seed-v1","steps":[{"step":1,"action":"advance_time","new_timestamp":"2026-08-15T00:00:00Z"},{"step":2,"action":"invoke","operation":"index","params":{}},{"step":3,"action":"invoke","capture_id":"as-of-history","operation":"query_as_of_state","params":{"query_id":"Q-S15"}}]}
