{"schema_version":"scenario-actions/v1","scenario_id":"S11","track":"Track3_ProvenanceTrace","name":"Organized to Raw Runs Drilling","initial_fixture":"p0-seed-v1","steps":[{"step":1,"action":"invoke","operation":"index","params":{}},{"step":2,"action":"invoke","capture_id":"organized-runs","operation":"query_sources","params":{"query_id":"Q-S11"}}]}
