{"schema_version":"scenario-actions/v1","scenario_id":"S18","track":"Track5_StaleImpact","name":"Negative Impact Preservation","initial_fixture":"p0-seed-v1","steps":[{"step":1,"action":"mutate","type":"create_version","target":"metric:M001","new_ref":"metric:M001@v2","entity_id":"M001","version_ref":"M001@v2","path":"definitions/M001/M001@v2.yaml","properties":{"previous":"M001@v1","threshold":"tightened"}},{"step":2,"action":"invoke","operation":"index","params":{}},{"step":3,"action":"invoke","capture_id":"unrelated-state","operation":"query_state","params":{"query_id":"Q-S18"}}]}
