{"schema_version":"scenario-actions/v1","scenario_id":"S17","track":"Track5_StaleImpact","name":"Raw Invalidation Stale Propagation","initial_fixture":"p0-seed-v1","steps":[{"step":1,"action":"invoke","operation":"index","params":{}},{"step":2,"action":"mutate","type":"raw_invalidation","target":"raw:R052","reason":"evaluation contamination"},{"step":3,"action":"invoke","operation":"index","params":{}},{"step":4,"action":"invoke","capture_id":"stale-after-invalidation","operation":"stale_status","params":{"ref":"raw:R052","entity":"R052"}}]}
