{"schema_version":"scenario-actions/v1","scenario_id":"S31","track":"Track8_LongHorizonContinuity","name":"Crash-Safety and Idempotent Recovery","initial_fixture":"p0-seed-v1","steps":[{"step":1,"action":"invoke","operation":"index","params":{}},{"step":2,"action":"snapshot_state","capture_id":"canonical-pre"},{"step":3,"action":"external_crash","capture_id":"after-staging-kill","operation":"freeze_report","params":{"idempotency_key":"oracle-s31","actor":"text-agent","authorization_ref":"AUTH-0001"},"pause_at":"after-staging","timeout_ms":30000},{"step":4,"action":"snapshot_state","capture_id":"canonical-after-crash"},{"step":5,"action":"invoke","capture_id":"reconcile-1","operation":"tx_reconcile","params":{}},{"step":6,"action":"snapshot_state","capture_id":"canonical-recovered-1","require_no_tx_residue":true},{"step":7,"action":"invoke","capture_id":"reconcile-2","operation":"tx_reconcile","params":{}},{"step":8,"action":"snapshot_state","capture_id":"canonical-recovered-2","require_no_tx_residue":true}]}
