{"schema_version":"scenario-actions/v1","scenario_id":"S32-A","track":"Track8_LongHorizonContinuity","name":"Derived Index Drift Recovery","initial_fixture":"p0-seed-v1","steps":[{"step":1,"action":"invoke","operation":"index","params":{}},{"step":2,"action":"mutate","type":"corrupt_index","target":".index/research.sqlite"},{"step":3,"action":"invoke","capture_id":"index-drift","operation":"reconcile_integrity","params":{}},{"step":4,"action":"invoke","operation":"index","params":{}},{"step":5,"action":"invoke","capture_id":"recovered-query","operation":"query_entity","params":{"ref":"spec:EXP-017@v1","entity_id":"EXP-017"}}]}
