{"schema_version":"scenario-actions/v1","scenario_id":"S19","track":"Track6_IntegrityAdversarial","name":"Severed Link Detection","initial_fixture":"p0-seed-v1","steps":[{"step":1,"action":"invoke","operation":"index","params":{}},{"step":2,"action":"mutate","type":"delete_file","target":"organized:EXP-017"},{"step":3,"action":"invoke","capture_id":"missing-source","operation":"query_sources","params":{"ref":"report:CURRENT","owner":"CURRENT"}}]}
