{"schema_version":"scenario-actions/v1","scenario_id":"S04","track":"Track1_DefinitionProvenance","name":"Definition Evolution and Rationale","initial_fixture":"p0-seed-v1","steps":[{"step":1,"action":"mutate","type":"create_version","target":"definition:H003@v1","new_ref":"definition:H003@v2","entity_id":"H003","version_ref":"H003@v2","path":"definitions/H003/H003@v2.yaml","properties":{"previous":"H003@v1","rationale_ref":"decisions/DEC-004.md"}},{"step":2,"action":"invoke","capture_id":"evolution","operation":"query_facts","params":{"query_id":"Q-S04"}}]}
