{"schema_version":"scenario-actions/v1","scenario_id":"S12","track":"Track3_ProvenanceTrace","name":"End-to-End Metric Penetration","initial_fixture":"p0-seed-v1","steps":[{"step":1,"action":"invoke","operation":"index","params":{}},{"step":2,"action":"invoke","capture_id":"metric-evidence","operation":"trace_evidence","params":{"ref":"claim:CURRENT#accuracy","entity":"organized/EXP-017/result.md"}}]}
