{"schema_version":"scenario-actions/v1","scenario_id":"S32-B","track":"Track8_LongHorizonContinuity","name":"Canonical Semantic Drift Defense","initial_fixture":"p0-seed-v1","steps":[{"step":1,"action":"invoke","operation":"index","params":{}},{"step":2,"action":"mutate","type":"semantic_tamper","target":"definition:H003@v1","content":"unauthorized_tamper: true\n"},{"step":3,"action":"invoke","capture_id":"semantic-drift","operation":"reconcile_integrity","params":{}}]}
