{"schema_version":"scenario-actions/v1","scenario_id":"S24","track":"Track6_IntegrityAdversarial","name":"Phantom Entity Hallucination Defense","initial_fixture":"p0-seed-v1","steps":[{"step":1,"action":"invoke","operation":"index","params":{}},{"step":2,"action":"invoke","capture_id":"phantom-version","operation":"query_entity","params":{"query_id":"Q-S24"}}]}
