{"schema_version":"scenario-actions/v1","scenario_id":"S06","track":"Track1_DefinitionProvenance","name":"Ambiguous Definition Rejection","initial_fixture":"p0-seed-v1","steps":[{"step":1,"action":"mutate","type":"create_version","target":"definition:H003@v1","new_ref":"definition:H003@v2","entity_id":"H003","version_ref":"H003@v2","path":"definitions/H003/H003@v2.yaml","content":"entity_id: H003\nversion_ref: H003@v2\nbody: canonical\n"},{"step":2,"action":"mutate","type":"duplicate_version","target":"definition:H003@v2","new_ref":"definition:H003@v2-duplicate","entity_id":"H003","version_ref":"H003@v2","path":"definitions/H003/H003@v2-duplicate.yaml","content":"entity_id: H003\nversion_ref: H003@v2\nbody: forged\n"},{"step":3,"action":"invoke","operation":"index","params":{}},{"step":4,"action":"invoke","capture_id":"ambiguous","operation":"query_entity","params":{"ref":"definition:H003@v2","entity_id":"H003"}}]}
