{"schema_version":"scenario-actions/v1","scenario_id":"S29","track":"Track8_LongHorizonContinuity","name":"Index Deletion Catastrophic Recovery","initial_fixture":"p0-seed-v1","steps":[{"step":1,"action":"invoke","operation":"index","params":{}},{"step":2,"action":"snapshot_index","capture_id":"index-before"},{"step":3,"action":"mutate","type":"delete_tree","target":".index"},{"step":4,"action":"invoke","operation":"index","params":{}},{"step":5,"action":"snapshot_index","capture_id":"index-after"}]}
