{"schema_version":"scenario-actions/v1","scenario_id":"S10","track":"Track3_ProvenanceTrace","name":"Claim to Organized Mapping","initial_fixture":"p0-seed-v1","steps":[{"step":1,"action":"invoke","operation":"index","params":{}},{"step":2,"action":"invoke","capture_id":"claim-source","operation":"query_sources","params":{"ref":"report:CURRENT","owner":"CURRENT"}}]}
