{"schema_version":"scenario-actions/v1","scenario_id":"S20","track":"Track6_IntegrityAdversarial","name":"Tampered Content Detection","initial_fixture":"p0-seed-v1","steps":[{"step":1,"action":"invoke","operation":"index","params":{}},{"step":2,"action":"mutate","type":"tamper_file","target":"artifact:R052:metrics","content":"101,0.01,0.999\n"},{"step":3,"action":"invoke","capture_id":"tamper-detection","operation":"reconcile_integrity","params":{}}]}
