{"schema_version":"scenario-actions/v1","scenario_id":"S08","track":"Track2_RunSpecBinding","name":"Spec Evolution Invariant","initial_fixture":"p0-seed-v1","steps":[{"step":1,"action":"mutate","type":"create_version","target":"spec:EXP-017@v1","new_ref":"spec:EXP-017@v2","entity_id":"EXP-017","version_ref":"EXP-017@v2","path":"experiments/EXP-017/spec-v2.yaml","content":"experiment_id: EXP-017\nversion: 2\n"},{"step":2,"action":"mutate","type":"create_version","target":"spec:EXP-017@v2","new_ref":"spec:EXP-017@v3","entity_id":"EXP-017","version_ref":"EXP-017@v3","path":"experiments/EXP-017/spec-v3.yaml","content":"experiment_id: EXP-017\nversion: 3\n"},{"step":3,"action":"invoke","operation":"index","params":{}},{"step":4,"action":"invoke","capture_id":"historical-binding","operation":"query_entity","params":{"ref":"run:R052","entity_id":"R052"}}]}
