{"schema_version":"scenario-actions/v1","scenario_id":"S05","track":"Track1_DefinitionProvenance","name":"Definition Lineage Ordering","initial_fixture":"p0-seed-v1","steps":[{"step":1,"action":"mutate","type":"create_version","target":"definition:H003@v1","new_ref":"definition:H003@v2","entity_id":"H003","version_ref":"H003@v2","path":"definitions/H003/H003@v2.yaml","properties":{"previous":"H003@v1"}},{"step":2,"action":"mutate","type":"create_version","target":"definition:H003@v2","new_ref":"definition:H003@v3","entity_id":"H003","version_ref":"H003@v3","path":"definitions/H003/H003@v3.yaml","properties":{"previous":"H003@v2"}},{"step":3,"action":"invoke","capture_id":"lineage","operation":"query_lineage","params":{"query_id":"Q-S05"}}]}
