{"schema_version":"scenario-actions/v1","scenario_id":"S03","track":"Track1_DefinitionProvenance","name":"External Literature Pinning","initial_fixture":"p0-seed-v1","steps":[{"step":1,"action":"mutate","type":"external_update","target":"external:paper-H003","content_hash":"sha256:514e0a4b9e5d04d2503ebe0f5193c341e5135177619c85d90647007f643c8931","content":"Updated online conclusion that must not replace the pinned historical conclusion.\n"},{"step":2,"action":"invoke","operation":"index","params":{}},{"step":3,"action":"invoke","capture_id":"external-basis","operation":"query_external_basis","params":{"query_id":"Q-S03"}}]}
