{"schema_version":"scenario-actions/v1","scenario_id":"S28","track":"Track8_LongHorizonContinuity","name":"Context Wipeout Recovery","initial_fixture":"p0-seed-v1","steps":[{"step":1,"action":"context_reset"},{"step":2,"action":"new_session","session_id":"fresh-session-s28","capture_id":"new-session"},{"step":3,"action":"invoke","operation":"index","params":{}},{"step":4,"action":"invoke","capture_id":"project-current","operation":"query_project_current","params":{"query_id":"Q-S28-CURRENT"}},{"step":5,"action":"invoke","capture_id":"project-index","operation":"query_project_index","params":{"query_id":"Q-S28-INDEX"}}]}
