{"schema_version":"scenario-actions/v1","scenario_id":"S07","track":"Track2_RunSpecBinding","name":"Run Spec Exact Binding","initial_fixture":"p0-seed-v1","steps":[{"step":1,"action":"invoke","operation":"index","params":{}},{"step":2,"action":"invoke","capture_id":"run-binding","operation":"query_entity","params":{"query_id":"Q-S07"}}]}
